{
  "$schema": "https://json-schema.org/draft/2020-12/schema",
  "$id": "https://github.com/os2display/display-templates/blob/develop/src/slideshow/slideshow-schema.json",
  "title": "slideshow schema",
  "description": "Content schema for slideshow",
  "type": "object",
  "properties": {
    "images": {
      "type": "array",
      "items": {
        "type": "string"
      }
    },
    "animations": {
      "type": "string"
    },
    "logo": {
      "type": "string"
    },
    "transitions": {
      "type": "string"
    },
    "imageDuration": {
      "type": "number"
    }
  }
}
