{
  "images": [
    "/v1/media/00000000000000000000000001",
    "/v1/media/00000000000000000000000002",
    "/v1/media/00000000000000000000000003",
    "/v1/media/00000000000000000000000004"
  ],
  "logo": "/v1/media/00000000000000000000000001",
  "transitions": "fade",
  "animations": "random",
  "imageDuration": 5000
}
